id	hypothesis	change	before	after	delta	tests	verdict	note
2026-09-23T02:25:00Z	h81-phaseB-d1-stop	the rewrite loader fix removes the duplicate target read and early binding removes the duplicate allocation, so the h49 failing configuration boots and fits at 20GB	controlled retest of h49 rung 1 with only the loader fix changed (4 slim patches on the 42-patch stack in fresh venv-slim20): MODEL=q38-lemin SPEC=mtp CTX=long MAX_LEN=16384 GPU_UTIL=0.95 with the TESTPLAN instrumented trace; run 1 died at init_device (ValueError: Free memory on device cuda:0 (18.46/19.57 GiB) on startup is less than desired) caused by my tracer creating CUDA contexts at interpreter start (resident 216 MiB in APIServer plus EngineCore; tracer fixed CUDA-free at startup and the HQT_INSTALLED env guard that skipped the spawned EngineCore was dropped); runs 2-3 reached target load then died at vllm/v1/spec_decode/llm_base_proposer.py:1399 in the slim-mtp-shared-loader can_share chain: AttributeError: NoneType object has no attribute load_format on self.speculative_config.draft_load_config which is None under the MTP CLI config	verbatim error and failing phase captured per the Phase B stop rule and the runtime ladder stopped there; trace evidence: Checkpoint size logged exactly once (single 15.79 GiB read, 8.36s load) versus twice in h49 so the duplicate target read is eliminated (claim 1 proven); 514 marlin repack samples over 257 target modules (weight_packed and weight_scale per module, MarlinLinearKernel); target settles at alloc 14.32 GiB reserved 16.92 max_alloc 16.69 resident 17.19 free 1.70 GiB at p3_before_draft_model_construct, then D1 aborts before any drafter allocation so early binding and its allocation saving (claim 2) are unmeasured and the 20GB MTP fit verdict is UNPROVEN; INDEX_CHECK PASS (hard error names all 5 absent mtp prefixes); q38-lemin has all 5 required prefixes (15 mtp tensors, 0 own-head, prebinding eligible)	3 instrumented boot arms + index and prefix checks; window closed with h76 restore verify	stopped per Phase B rule; fit unproven	top follow-on is a one-line fix in the slim-mtp-shared-loader can_share chain (read load_format via getattr(self.speculative_config.draft_load_config, "load_format", "auto")) regenerated through scripts/export-patch.sh per PATCHES.md (do not hand-edit patch files), then one re-run of this same arm; receipts results/hq20-slim20gb/box/ (phaseB-arm.log = run 1, phaseB-arm2.log and phaseB-arm3.log = D1 with trace, phaseB-trace.jsonl, phaseB-trace-table.txt)
2026-09-23T02:47:00Z	h82-h76-restore	window B closed per protocol with production restored and verified	clear crashed arm remnants (none held GPU), binary gate /home/jamie/llama.cpp-turboq-mtp/build/bin/llama-server test -x and --version run, launcher restored from /home/jamie/llama/llama-serve.sh.h76-savepoint-h77, watchdog restarted, band check run, supervisor unfrozen	version 1 (aaa66a5) built with GNU 16.2.1; launcher RESTORED_IDENTICAL (diff empty vs savepoint); /health 200 after 30s; h76verify 3x600 tok temp 0: client 64.83/65.89/68.76 median 65.89, engine predicted_per_second 72.30 inside the 71-77 band, draft 394 of 612 accepted (accepted in the 350-450 band; drafted 612 is +5.5% vs the 580-597 reference on this prompt shape), watchdog active, resident 19391 MiB, supervisor 34846 running (Rs)	n=3 verify	kept-baseline	production remains the h76 profile untouched; receipts results/hq20-slim20gb/box/h76verify.txt
2026-09-23T03:10:00Z	h83-d1-fix	the authorized getattr fix clears the can_share crash so the exact h81 arm proceeds into the shared-load construction	folded getattr(self.speculative_config.draft_load_config, "load_format", "auto") into the slim-mtp-shared-loader can_share chain per authorization; the commit stack was rebuilt by cherry-pick to keep topic purity after the first fixup rebase leaked and not draft_has_own_head into shared-loader: shared-loader d7b59eb5d -> 045ea3521, int4-cache 3720e499b -> f6a2ef968, draft-geometry c633aefb0 -> 8f4ea00c9, own-head 9a145ba8e -> 01963bcae (all local-only, ahead 4 of origin); all four patches regenerated through scripts/export-patch.sh with audit passing (and not draft_has_own_head absent from shared-loader, present once in own-head, getattr as shared-loader addition and as own-head carried context); venv tree rebuilt from the regenerated series after a clean pip uninstall and install because --force-reinstall did not replace the tree	D1 AttributeError gone: can_share evaluates cleanly and the re-run reaches the shared-load construction; verify.sh --install OK 0 failures with PATH=/opt/cuda/bin (carried context applies), compileall OK, created-file patches present; trace reproduces the target side exactly (p1, 514 p4 repacks over 257 modules, p2, p3 fired) at alloc 14.32 reserved 16.92 resident 17.19 free 1.70 GiB	verify.sh --install + 1 instrumented arm re-run	kept (D1 cleared)	receipts results/hq20-slim20gb/box2/ (four regenerated patches, fixd1.py, resolve scripts, ladder-h83-conq.log, trace jsonl and table, verify-install3.txt); new SHAs as named above
2026-09-23T03:15:00Z	h84-d2-stop-restore	with D1 cleared the conquered case boots and the fit ladder can run	the exact h81 arm re-run continued one step past can_share and died in the shared-load construction on a second unguarded draft_load_config dereference	verbatim: AttributeError: NoneType object has no attribute model_loader_extra_config at DefaultModelLoader.__init__ (extra_config = load_config.model_loader_extra_config) reached from llm_base_proposer._get_model at model = DefaultModelLoader(self.speculative_config.draft_load_config) with draft_load_config None; failing phase: drafter construction, shared-load DefaultModelLoader construction, after can_share, before any drafter allocation (trace shows p3 fired and no p5); new blocker per the stop rule so the fit ladder, the measurement suite and the Phase D quality battery are unrun and the 20GB MTP fit verdict stays UNPROVEN; window C closed per protocol: binary aaa66a5 passes test -x and --version, launcher RESTORED_IDENTICAL from the savepoint, /health 200 in 30s, h76verify VERIFY PASS engine_decode=72.19 draft=394/612, watchdog active, resident 19128 MiB, supervisor 34846 resumed	1 arm re-run + window closeout verify	stopped per new-blocker rule; fit unproven	top follow-on: fix both draft_load_config call sites in slim-mtp-shared-loader._get_model with the same defaulting form (DefaultModelLoader(self.speculative_config.draft_load_config or LoadConfig()) and load_config=self.speculative_config.draft_load_config or LoadConfig(), with LoadConfig imported), regenerate through scripts/export-patch.sh, re-run the same arm; receipts results/hq20-slim20gb/box2/ladder-h83-conq.log
2026-09-23T04:10:00Z	h85-conq-fit-proven	the D2 class fix clears the shared-load crash so the exact h49 failing configuration boots with MTP on the 20GB card	normalized once at _get_model entry per authorization (draft_load_config = self.speculative_config.draft_load_config or LoadConfig(), LoadConfig from vllm.config.load) and threaded both call sites; D3 sweep recorded before the rerun (2 at-risk derefs at llm_base_proposer.py:1340 and :1349 fixed by the threading, :1399 already guarded, 15 DefaultModelLoader load_config derefs covered by the normalization, draft_model_config non-None by construction, no D3 candidate in scope, receipt box3/d2-sweep.txt); stack rebuilt by cherry-pick with clean topic split (shared-loader 045ea3521 -> 59a0234aa, int4-cache f6a2ef968 -> 53da3289d, draft-geometry 8f4ea00c9 -> 6c5db5435, own-head 01963bcae -> cfd09dcb9, local-only ahead 4); four patches regenerated through export-patch.sh with audit passing; venv tree rebuilt via clean uninstall and install; the deliberate window-stop SIGTERM teardown artifact in llama-server.log noted per HyperQwenHillclimb read-only observation (std::terminate in the stream_session_manager destructor on pkill, gdb dump appended, self-recovered, not an arm crash and not in the crash-reject class)	MTP BOOTS AND SERVES at MODEL=q38-lemin SPEC=mtp CTX=long MAX_LEN=16384 GPU_UTIL=0.95: HEALTH_OK in 240s, 600 tok at e2e 71.05, mean acceptance length 2.59, KV pool 33236 tokens at 2.03x concurrency, one checkpoint read; full TESTPLAN trace captured (p1, 514 p4 repacks, p2, p3, p3_draft, p4x, p5, p6b x5, p6c) with embed_identity true, head_identity true, shared_modules 2, draft_only true proving the early binding shares the target embedding and head; drafter adds only 0.85 GiB (p3 alloc 15.38 to p5 alloc 16.23); whole stack including KV and CUDA graphs settles at alloc 18.31 GiB, reserved 18.49, resident 18.88, free 1.33 GiB where h49 died at 17.52 alloc refusing a 1.19 GiB request; 20GB MTP fit verdict PROVEN at 16384	verify.sh --install 0 failures + D3 sweep + 1 instrumented boot and smoke	kept (conquered case proven)	receipts results/hq20-slim20gb/box3/ and box/ (ladder-h85-conq.log, ladder-h85-conq-trace.jsonl, ladder-h85-conq-trace-table.txt)
2026-09-23T04:15:00Z	h86-6k	fit rung MAX_LEN 6144 on fp8 boots and serves	fit gate via rung.sh h86-6k 6144 fp8	HEALTH_OK in 240s, KV pool 18966 tokens at 3.09x concurrency, smoke 600 tok e2e 72.29, mean acceptance 2.71, one checkpoint read, resident 19576 MiB	fit gate + smoke	kept-fact	receipts box/ smoke-h86-6k.txt, ladder-h86-6k.log, ladder-h86-6k-trace.jsonl
2026-09-23T04:18:00Z	h87-24k	fit rung MAX_LEN 24576 on fp8 boots and serves	fit gate via rung.sh h87-24k 24576 fp8	HEALTH_OK in 240s, KV pool 38775 tokens at 1.58x concurrency, smoke 600 tok e2e 70.27, mean acceptance 2.66, one checkpoint read, resident 19576 MiB	fit gate + smoke	kept-fact	receipts box/ smoke-h87-24k.txt, ladder-h87-24k.log, ladder-h87-24k-trace.jsonl
2026-09-23T04:22:00Z	h88-60k	fit rung MAX_LEN 61440 on fp8 fits the KV budget	fit gate via rung.sh h88-60k 61440 fp8	ARM_DIED at engine init, ValueError from kv_cache_utils: To serve at least one request with the model's max_model_len (the KV pool cannot hold 61440 tokens at the fp8 bytes per token within the 0.95 budget), memory-bound refusal not a code defect; the declared int4 per-token-head cache contingency applies	fit gate	refused-fp8 (depth requires the int4 path)	receipts box/ ladder-h88-60k.log (the refusal is the depth trigger named in the brief)
2026-09-23T04:25:00Z	h89-91k	fit rung MAX_LEN 93184 on fp8 fits the KV budget	fit gate via rung.sh h89-91k 93184 fp8	ARM_DIED at engine init, same kv_cache_utils ValueError class, memory-bound	fit gate	refused-fp8	receipts box/ ladder-h89-91k.log
2026-09-23T04:30:00Z	h90-60k-int4	fit rung MAX_LEN 61440 with the int4 per-token-head cache (commit 2 path, --kv-cache-dtype int4_per_token_head --attention-backend TRITON_ATTN) fits and serves	fit gate via rung.sh h90-60k-int4 61440 int4	HEALTH_OK in 240s, KV pool 75093 tokens at 1.22x concurrency (2.26x the fp8 pool), smoke 600 tok decode 81.32 e2e 79.87 ttft 0.15s, one checkpoint read, resident 18760 MiB (lower than fp8 at smaller rungs)	fit gate + smoke	kept (WINNING SHAPE: MAX_LEN 61440 int4 per-token-head cache, GPU_UTIL 0.95)	receipts box/ smoke-h90-60k-int4.txt, ladder-h90-60k-int4.log, ladder-h90-60k-int4-trace.jsonl (p6a int4 scratch plan captured)
2026-09-23T04:33:00Z	h91-91k-int4	fit rung MAX_LEN 93184 with the int4 per-token-head cache fits and serves	fit gate via rung.sh h91-91k-int4 93184 int4	ARM_DIED at engine init, same kv_cache_utils ValueError class: the 75093-token int4 pool ceiling is below the 93184 the rung requires; the 91k rung is unfittable on both declared KV types and the fit ladder verdict is 6144 yes, 24576 yes, 61440 yes on int4, 93184 no on either	fit gate	refused-int4 (91k rung unfittable)	receipts box/ ladder-h91-91k-int4.log
2026-09-23T04:45:00Z	h92-measure	the slim-20gb MTP stack at the winning shape competes with the turboq h76 profile at the fresh and depth points	measurement suite at the winning shape (MODEL=q38-lemin SPEC=mtp CTX=long MAX_LEN=61440 GPU_UTIL=0.95 PORT=18020 EXTRA_ARGS=--kv-cache-dtype int4_per_token_head --attention-backend TRITON_ATTN, MTP k=3 draft_sample_method probabilistic, max_num_batched_tokens 2048, MAX_SEQS 8, CUDA_HOME=/opt/cuda with PATH=/opt/cuda/bin, expandable_segments True), 600 tok temp 0, one discarded warmup plus five samples per point, fills 0, 33355 and 60000 (the 91k point is fit-blocked at this shape so 60000 with 600 gen is the deepest held and serves as the 91k-equivalent), client stream boundaries for ttft and the decode window with prefill derived from ttft	fresh decode 84.69 (runs 84.89/84.75/84.69/84.58/84.49), e2e 83.22, ttft 0.13s, prompt 69 tok, against the turboq bar 76.41 = +10.8%; 33k point at 33167 prompt tok decode 24.79, e2e 20.31, ttft 5.38s, against bar 57.51 = -56.9%; 60k deep point at 59647 prompt tok decode 17.61, e2e 13.69, ttft 9.82s (the 91k bar 54.40 has no counterpart, the point is fit-blocked at this shape); draft acceptance fresh 398 of 603 drafted (66.0 percent, per-position 177/126/95 of 201 drafts); prefill_derived reads 6153 and 6062 tok/s at depth which is implausibly fast against the turboq 948 and is flagged client-derived with raw first chunks captured for audit; decode is the comparison metric and the honest verdict is fresh wins plus 10.8 percent while depth loses to the documented Triton-attention and int4 unpack tax	3 points x (warmup + 5)	kept-fact (fresh win, depth loss)	receipts results/hq20-slim20gb/box3/measure-fresh.txt, measure-33k.txt, measure-60k.txt
2026-09-23T04:50:00Z	h93-quality	the Phase D battery passes on the winning shape	depth recall with unique-prefix literals at 33355 and 60000 fills, fixed-prompt comparison against the staged turboq outputs at temp 0, and a tool-call check against the registry tools claim	depth recall 4 of 4 at 33k (LHJ7065-ZHNP, GAZUB QZGQSB, 51791, VVCBKHA ZRLKAX) and 4 of 4 at 59647 tok (AVR3379-RSZX, BNILY UOYRKL, 48934, RHXBIGI BCSLZP), both verbatim; fixed prompt at temp 0 answers XKQ-1138, MARO VESS, 47291, CATTLEYA LUMINA which is byte-identical to the turboq profile output in results/h59-fg-ladder/f1-quality-probe.txt; tool-call check PASS with tool_calls get_weather and arguments {"city": "Copenhagen"} and finish_reason tool_calls through the qwen3_coder parser	3 probes	kept (quality battery all green)	receipts results/hq20-slim20gb/box3/recall-33k.txt, recall-60k.txt, quality-fixed.txt, toolcheck.txt
2026-09-23T04:55:00Z	h94-final-restore	measurement window closed per protocol with production restored and verified	binary /home/jamie/llama.cpp-turboq-mtp/build/bin/llama-server passes test -x and --version, launcher restored from /home/jamie/llama/llama-serve.sh.h76-savepoint-h77, watchdog restarted, band check run, supervisor unfrozen	version 1 (aaa66a5) built with GNU 16.2.1; launcher RESTORED_IDENTICAL; /health 200 in 30s; h76verify VERIFY PASS engine_decode=71.87 draft=394/612; watchdog active; resident 19450 MiB; supervisor 34846 running (Rs); all three window closes this unit verified PASS (72.30, 72.19, 71.87 engine decode, draft 394/612 each)	n=3 verify	kept-baseline	production remains the h76 profile untouched; receipts results/hq20-slim20gb/box3/h76verify3.txt
2026-09-23T04:49:49Z	h95-inherit	the released winning shape is the hillclimb baseline and no measurement gets rerun	R0 inherit per the brief: binding slots adopted from the BuildTest release without a window (ROW_BASE h95, fills 0/33355/60000, noise bands fresh 84.49-84.89, 33k 24.79-24.80, 60k 17.55-17.64)	baseline at WIN_CFG: fresh 84.69 decode (e2e 83.22), 33k 24.79 (20.31), 59647pt 17.61 (13.69), draft 398/603 fresh (66.0%), int4 pool 75093 tokens (configured MAX_LEN 61440), quality battery green per h93; vs turboq 76.41/57.51/54.40 = +10.8% fresh, -56.9% at 33k, 91k bar fit-blocked	none (inherit, no window)	kept-baseline	keep gates made concrete from the noise bands: at-depth bar is 27.27 at 33k or 19.37 at 60k with fresh at or above 83.00 (2 percent of 84.69); window bar is 92160+ tokens with at-depth cost under 10 percent and recall intact; ladder order results/hq20-hillclimb/RUNG-ORDER.md at abb92fd; baseline receipts results/hq20-slim20gb/box3/measure-*.txt
2026-09-23T05:32:25Z	h97-r2a-draft2	shorter draft chain k=2 avoids speculative penalties at depth where acceptance decays and might lift depth decode (depth-first draft sweep R2)	one variable DRAFT_TOKENS=2 against baseline k=3 at the winning shape (GPU_UTIL 0.95, MAX_LEN 61440 int4 per-token-head TRITON_ATTN), fills 0 33355 60000 with n=5 plus warmup, recall seed 2026092321 at fill 60000	fresh 79.65 dec runs 79.89/79.78/79.65/79.57/79.51 vs 84.69 = -5.9 percent FAILING the 2 percent guardrail floor 83.00; 33k 26.11 vs 24.79 = +5.3 percent but misses the +10 percent bar 27.27; 60k 17.44 vs 17.61 = -1.0 percent; draft acceptance rate jumped sharply (fresh 363/472 = 76.9 percent vs 66.0, 33k 360/478 = 75.3 percent vs 50.6, 60k 366/466 = 78.5 percent vs 56.6) but fewer total tokens drafted per step (1.54 vs 1.98 fresh); recall 4/4 at 59647, fixed prompt 4/4	3 points x (warmup + 5), recall at 60000, qualityfixed, closeout band check	reverted	both gates fail: fresh decode drops 5.9 percent below the guardrail floor and 33k gain (+5.3 percent) misses the +10 percent bar; shorter chains lift acceptance rate by ~25 pp at depth but starve single-stream generation length; champion stays k=3; closeout verify read engine 70.85 draft 394/612 matching the thermal drift pattern from h96; receipts results/hq20-hillclimb/receipts/r2a-fill0.txt r2a-fill33355.txt r2a-fill60000.txt r2a-recall60000-seed2026092321.txt r2a-quality.txt r2a-h76verify.txt
